{
  "schema": "skill-rails/g0.5-review/1",
  "reviewer_id": "codex-a2",
  "provider": "codex",
  "form": "a",
  "findings": [
    { "coordinate": "evals/g0_5/a-prose/mutated.md:11", "claim": "The negated code-defect predicate leaves an ordinary first code finding without any matching review row.", "state": { "signal.pass": "yes", "review.lastVerdict": "finding", "review.lastTarget": "code", "review.ordinal": 1, "review.disposition": "NONE", "artifact.reviewLogPresent": "no", "session.readOnly": "no" }, "expected": "Select an ordinary code-repair path that records the finding, repairs it, obtains a clean review, and continues according to that result.", "actual": "Row 1 is false because the review does find a code defect, row 2 is false because the ordinal is below three, and rows 3-6 are false, so no row supplies effects or a next stage.", "reproducible": true },
    { "coordinate": "evals/g0_5/a-prose/mutated.md:11-15", "claim": "The first row's broad negative predicate shadows the specialized rows for recognized non-code outcomes.", "state": { "signal.pass": "yes", "review.lastVerdict": "pass", "review.lastTarget": "NONE", "review.ordinal": 0, "review.disposition": "NONE", "artifact.reviewLogPresent": "no", "session.readOnly": "no" }, "expected": "Row 5 should write the unrecorded pass result and re-enter the flow.", "actual": "Row 1 matches first because a pass is not a code defect, so it calls for another clean reviewer after a nonexistent repair and writes that result instead of applying row 5.", "reproducible": true },
    { "coordinate": "evals/g0_5/a-prose/mutated.md:12", "claim": "The human-escalation row stops before persisting an unrecorded third code finding.", "state": { "signal.pass": "yes", "review.lastVerdict": "finding", "review.lastTarget": "code", "review.ordinal": 3, "review.disposition": "NONE", "artifact.reviewLogPresent": "no", "session.readOnly": "no" }, "expected": "The third finding should be durably recorded before the flow asks for human disposition and stops.", "actual": "Row 2 only asks the human and stops, so the supplied absent review log remains absent.", "reproducible": true },
    { "coordinate": "evals/g0_5/a-prose/mutated.md:9-16", "claim": "The table has no explicit fail-closed fallback for an unknown review verdict.", "state": { "signal.pass": "yes", "review.lastVerdict": "mystery", "review.lastTarget": "NONE", "review.ordinal": 0, "review.disposition": "NONE", "artifact.reviewLogPresent": "no", "session.readOnly": "no" }, "expected": "An unrecognized verdict should block with an explicit reason and stop without dispatch or write effects.", "actual": "Under the literal negative predicate, row 1 consumes the unknown verdict and proposes dispatch and write effects; under strict verdict classification no row matches, so the prose supplies no deterministic safe termination either way.", "reproducible": true },
    { "coordinate": "evals/g0_5/a-prose/mutated.md:11,22", "claim": "A recorded pass receives conflicting instructions to dispatch another reviewer and to report completion.", "state": { "signal.pass": "yes", "review.lastVerdict": "pass", "review.lastTarget": "NONE", "review.ordinal": 0, "review.disposition": "NONE", "artifact.reviewLogPresent": "yes", "session.readOnly": "no" }, "expected": "A recorded pass should report completion and stop with no further review effects.", "actual": "Top-to-bottom table evaluation selects row 1 and calls for dispatch and write, while line 22 independently says to report completion and stop.", "reproducible": true },
    { "coordinate": "evals/g0_5/a-prose/mutated.md:20", "claim": "Declaring review records write-only prevents a resumed flow from recovering a recorded pass and can trigger duplicate review work.", "state": { "signal.pass": "yes", "persistedReview": { "verdict": "pass", "recorded": "yes" }, "currentSessionReview": "NONE", "session.readOnly": "no" }, "expected": "The resumed flow should read the persisted pass, report completion, and stop.", "actual": "Because no later component reads the record, the resumed flow observes no review and row 6 dispatches and records another reviewer instead.", "reproducible": true }
  ],
  "answers": [
    { "id": "q1", "answer": "The next stage is the completion check; the ordered plan is run the check, WRITE its evidence record, then re-enter the flow." },
    { "id": "q2", "answer": "No review-table row matches this state, so the artifact defines no effects or next stage; the ordinary repair path is missing for a first code finding." },
    { "id": "q3", "answer": "The broken-record boundary wins: row 2 applies, ASK the human for a disposition, then stop; as written, it performs neither repair nor review-record WRITE." },
    { "id": "q4", "answer": "It has no safe deterministic termination: a literal reading of row 1 treats the mystery verdict as not a code defect and dispatches/writes, while a strict classification leaves it unmatched because there is no fallback." },
    { "id": "q5", "answer": "No; line 5 requires a read-only session to block any plan requiring DISPATCH or WRITE before that plan is shown." }
  ],
  "notes": "The artifact was assessed only from the authorized brief, state questions, and A-form prose. The most consequential interaction is that row 1 is simultaneously too narrow for ordinary code findings and too broad for every non-code or unknown outcome."
}
